Timestamp,Speaker,Words,Tags
30:45:00,Ron Beebe,"Well, there was a lot going on and a lot of different things in the news. The, um, there was a, uh, uh, a black woman on a bus that sat in front of the bus when she wasn't supposed to. Yeah. And, um, she was arrested and then there were, uh, some, uh, there was a, um, Oh, I can't think of his name right now. He was governor of, um, Alabama. Alabama. Yeah. I think it was.",crm
31:14:00,Ron Beebe,and he was not going to allow black students to go to a white school. And then he was shot and became paralyzed and was in a wheelchair after that. So there was a lot of anger going on. And it was more in the South than in the North because the South still had that segregation mindset. And they grew up that way. And their parents were very hateful toward black people. So.,crm
31:44:00,Ron Beebe,"Children would just adopt the attitudes that their parents had toward it. So there was a difference between living in the North and living in the South. But when Martin Luther King was doing his marches, and then of course, when he was assassinated, that was all over TD. And it was kind of sad to see he was just a preacher that was trying to do",mlk
,Ron Beebe,what he thought was right and what the Bible was teaching him or what he was reading from the Bible and he gave his life for that.,mlk
,Silas Beebe,So that specifically resonated with you guys being Christians.?,
32:34:00,Jane Beebe,"Very much so and I guess personally because both Uncle Ron, both Pop and myself, we went to schools that were very integrated.So I had a very high population of Black students in the school that I went to. So it really didn't impact us because that was just common everyday life for us to interact with them and to live with them. But there was a distinct line where people...",crm
,Jane Beebe,"Black people lived on the other side of 63rd Street, and the white people lived on this side of the 63rd Street. And one thing that I remember was that a Black family moved into, they crossed the line, and they moved into the white section. And I remember people throwing rocks at their house and windows being broken.",crm
33:00:00,Jane Beebe,And it got so bad that they actually had to have police stationed outside of the house because they were the first family to move into the white section and people were not not happy about it at all. ,crm
,Silas Beebe,"So ive heard similar things like when I was working for the Idaho Black History Museum in Boise, there was an area that was like across the tracks that was down by the river where was the same exact situation.",
33:29:00,Silas Beebe,"And the guy I was working for, Philip, when his family moved across the street, they had a cross burned on their front yard and they were Baptists.",
,Jane Beebe,"Yes, they did the same thing. They had a cross that they burned there too. Yep, they did the same thing. ",crm
34:00:00,Silas Beebe,"Shifting out of the civil rights movement a little bit, something a little more positive, what music did you guys listen to in the 1960s?",
,Jane Beebe,Can you answer that?,music
,Ron Beebe,"P: I was listening to a lot of country music in those times, but it was more, I guess there was, what was it called, Bandstand in Philadelphia where there was a place where young kids would come after school and they would dance and there were different people.",
34:30:00,Ron Beebe,"They had a DJ that would play the records and then people would dance. Yeah, and they would dance and anytime a new record would come out, it would be debuted, so to speak, from the bandstand location. So there were a lot of kids would go there and it was more of cliquish, the people that went and they were filled with themselves.",music
35:00:00,Ron Beebe,"and wanted to be on TV. And that's their main reason for going. But there were a lot of different dances, dance movements that got started and you could see them on bandstand. And Grammy and I used to go to a Catholic church in Upper Darby, right outside of Philadelphia and close to where Grammy lived, to go to the dances. And they had slow dances, fast dances, and...",music
35:30:00,Ron Beebe,"They would also, what was the other dance? Cha Cha. Cha Cha dances.",music
,Silas Beebe,"Pop, you a good dancer?",
,Ron Beebe,"We got into a dance contest one time. Yeah, we won the twist contest. Yeah, the twist contest. Chubby Checker.",music
,Silas Beebe,Did you win? Did you get close to winning?,
,Jane Beebe,"Yeah, we did, we won that one.",music
,Silas Beebe,"You won? Oh, that's awesome. That's cool.",
,Jane Beebe,"That was like when the Beatles were really popular and, Okay. You know, it was a lot of rock and raw. I mean, I honestly listened to more, Johnny Mathis was one of my favorite musicians and he is, I think I just told Poppy's like 89 and he's still gonna be down at Atlantic City singing. Oh my goodness. I know, I was blown away. It's like, this man is still around. ",music
,Silas Beebe,"Johnny Mathis, okay.",
,Ron Beebe,"And then they would have, there were a couple of clubs that were not necessarily for people over 21 and they would bring some musicians in and then you could go to those locations and see them live. Bobby Rydell. He was a big one. Yeah. And Chubby Checkers and he used to have his own little dance routine for that.",music
,Ron Beebe,P: But there's something you might be interested in now is the same place where Bandstand was. Right next to that was where you would go roller skating. That's where Grammy and I met on the roller skating. Okay. And would also be converted into a wrestling ring.,music
,Silas Beebe,Whoa.,
,Ron Beebe,And all the wrestlers that were popular at that time. That's right. Would come there to wrestle.,wrestling
35:30:00,Silas Beebe,"Okay, I remember my dad. I think he said that you took him to a few wrestling matches, Pop.",wrestling
,Silas Beebe,"Yeah, this wouldn't be in the 60s. That would be in, you know, in the 70s and 80s. Did you ever take him to any boxing fights?",
,Ron Beebe,"No, no. We would watch boxing on TV with Muhammad Ali or Cassius Clay, as he was called then, and Frazier. And yeah, that was it was usually, I think, on Friday nights, if I'm not mistaken. Yeah. And that was the big thing. Families wanted to get home and watch the fights.",sports
37:49:00,Silas Beebe,"Oh, that's funny. That's what we do every Saturday now with UFC. I've got a poster of Cassius Clay in my room or Muhammad Ali. That's cool you guys gotta see that live. So how overall did you see the culture of the nation shift throughout the 1960s? What did it shift away from? What did it shift toward?",
38:14:00,Jane Beebe,"Well, I think for me, what I saw was a kind of a movement of people moving from a city to the country, to the suburbs. And that happened a lot during the 60s where, again, because there was that, I'm going to call it infringement of different people, other than the",
38:43:00,Jane Beebe,"Irish or Scottish or English moving into the area. And so consequently it was, they lost their identity because the culture changed and a lot of Italians moved into where I was. And then when that black family moved in, I think people were threatened that this now was going to change their environment.",
39:11:00,Jane Beebe,"So there was a vast exit of people moving to the suburbs from the area that I lived in. Okay, we've read about that exact phenomenon.",
,Silas Beebe,"I think they call it urban flight. Yes, yes. We've talked about that pretty extensively.",